{
  "$defs": {
    "ErrorDetail": {
      "properties": {
        "code": {
          "type": "string"
        },
        "constraint_ids": {
          "items": {
            "type": "object"
          },
          "type": "array"
        },
        "data": {
          "type": "object"
        },
        "message": {
          "type": "string"
        },
        "objects": {
          "items": {
            "type": "string"
          },
          "type": "array"
        }
      },
      "required": [
        "message"
      ],
      "type": "object"
    },
    "FramingVerdict": {
      "properties": {
        "checked": {
          "enum": [
            "computed",
            "cached",
            "unavailable"
          ]
        },
        "fits": {
          "anyOf": [
            {
              "type": "boolean"
            },
            {
              "type": "null"
            }
          ]
        },
        "ratio": {
          "anyOf": [
            {
              "type": "number"
            },
            {
              "type": "null"
            }
          ]
        },
        "stale_reason": {
          "anyOf": [
            {
              "type": "string"
            },
            {
              "type": "null"
            }
          ]
        }
      },
      "required": [
        "fits",
        "ratio",
        "checked",
        "stale_reason"
      ],
      "type": "object"
    },
    "ImageRef": {
      "properties": {
        "audience": {
          "items": {
            "type": "string"
          },
          "type": "array"
        },
        "data_b64": {
          "type": "string"
        },
        "kind": {
          "enum": [
            "resource_link",
            "inline"
          ]
        },
        "label": {
          "type": "string"
        },
        "mime_type": {
          "type": "string"
        },
        "uri": {
          "type": "string"
        }
      },
      "type": "object"
    }
  },
  "$id": "fcb.result-envelope/1",
  "$schema": "https://json-schema.org/draft/2020-12/schema",
  "properties": {
    "detail": {
      "anyOf": [
        {
          "$ref": "#/$defs/ErrorDetail"
        },
        {
          "type": "null"
        }
      ]
    },
    "framing": {
      "anyOf": [
        {
          "$ref": "#/$defs/FramingVerdict"
        },
        {
          "type": "null"
        }
      ]
    },
    "images": {
      "items": {
        "$ref": "#/$defs/ImageRef"
      },
      "type": "array"
    },
    "schema": {
      "const": "fcb.result-envelope/1"
    },
    "status": {
      "enum": [
        "OK",
        "SPEC_FAILED",
        "RECOMPUTE_ERROR",
        "TIMEOUT",
        "OOM_KILLED",
        "WORKER_CRASHED",
        "INVALID_INPUT"
      ]
    },
    "structured_content": {
      "type": "object"
    },
    "text": {
      "type": "string"
    },
    "text_blocks": {
      "items": {
        "type": "string"
      },
      "type": "array"
    }
  },
  "required": [
    "schema",
    "status",
    "structured_content",
    "text"
  ],
  "title": "ResultEnvelope",
  "type": "object"
}
