{
 "schema": "fcb.result-envelope/1",
 "status": "OK",
 "detail": null,
 "structured_content": {
  "doc": "fcb-doc:5sQtL5ZfjtHBdc0b0xDvjg",
  "total_objects": 1,
  "returned_nodes": 1,
  "depth": 1,
  "filters_applied": {
   "exclude_types": [
    "App::Plane",
    "App::Line",
    "App::Point",
    "App::Origin"
   ]
  },
  "tree": [
   {
    "name": "Box",
    "label": "Box",
    "type": "Part::Feature",
    "visibility": true
   }
  ]
 },
 "text": "1 objects, 1 shown.\n\nWarning: the model does not fully fit the live viewport, so the human is seeing only part of it. Call view_fit_viewport to fit it, if they need to see this change.",
 "framing": {
  "fits": false,
  "ratio": 2.648786717752235,
  "checked": "cached",
  "stale_reason": "served from cache; unverified key component(s): geometry"
 }
}
