{
 "schema": "fcb.result-envelope/1",
 "status": "OK",
 "detail": null,
 "structured_content": {
  "freecad_version": "1.1.4",
  "element_map_available": true,
  "serializer": "exportBinary",
  "varset_backend": "varset",
  "render": "gui_constructed",
  "sketcher_available": true,
  "partdesign_available": true,
  "enums": {
   "PartDesign::Pad": {
    "Type": [
     "Length",
     "UpToLast",
     "UpToFirst",
     "UpToFace",
     "?TwoLengths",
     "UpToShape"
    ]
   },
   "PartDesign::Pocket": {
    "Type": [
     "Length",
     "ThroughAll",
     "UpToFirst",
     "UpToFace",
     "?TwoLengths",
     "UpToShape"
    ]
   },
   "PartDesign::Revolution": {
    "Type": [
     "Angle",
     "UpToLast",
     "UpToFirst",
     "UpToFace",
     "TwoAngles"
    ]
   },
   "PartDesign::Hole": {
    "ThreadType": [
     "None",
     "ISOMetricProfile",
     "ISOMetricFineProfile",
     "UNC",
     "UNF",
     "UNEF",
     "NPT",
     "BSP",
     "BSW",
     "BSF",
     "ISOTyre"
    ],
    "HoleCutType": [
     "None",
     "Counterbore",
     "Countersink",
     "Counterdrill"
    ],
    "DepthType": [
     "Dimension",
     "ThroughAll"
    ]
   },
   "PartDesign::Chamfer": {
    "ChamferType": [
     "Equal distance",
     "Two distances",
     "Distance and Angle"
    ]
   },
   "PartDesign::LinearPattern": {
    "Mode": [
     "Extent",
     "Spacing"
    ],
    "TransformMode": [
     "Features",
     "Whole shape"
    ]
   },
   "PartDesign::PolarPattern": {
    "Mode": [
     "Extent",
     "Spacing"
    ]
   }
  },
  "exec_enabled": false
 },
 "text": "element_map_available: True\nenums: {7 fields}\nexec_enabled: False\nfreecad_version: 1.1.4\npartdesign_available: True\nrender: gui_constructed\nserializer: exportBinary\nsketcher_available: True\nvarset_backend: varset"
}
