{
 "schema": "fcb.result-envelope/1",
 "status": "OK",
 "detail": null,
 "structured_content": {
  "fitted": true,
  "document": "box_10_20_30",
  "camera_recorded": true
 },
 "text": "fitted the live viewport to 'box_10_20_30'",
 "framing": {
  "fits": true,
  "ratio": 0.9489144316730523,
  "checked": "computed",
  "stale_reason": null
 }
}
