{
 "schema": "fcb.result-envelope/1",
 "status": "OK",
 "detail": null,
 "structured_content": {
  "fitted": true,
  "document": "S5SketchOnly",
  "camera_recorded": true
 },
 "text": "fitted the live viewport to 'S5SketchOnly'",
 "framing": {
  "fits": true,
  "ratio": 0.9491371480472298,
  "checked": "computed",
  "stale_reason": null
 }
}
