{
 "schema": "fcb.result-envelope/1",
 "status": "OK",
 "detail": null,
 "structured_content": {
  "fitted": true,
  "document": "S6MeshOnly",
  "camera_recorded": true
 },
 "text": "fitted the live viewport to 'S6MeshOnly'",
 "framing": {
  "fits": true,
  "ratio": 0.9505907626208379,
  "checked": "computed",
  "stale_reason": null
 }
}
